{
  "$schema": "https://json-schema.org/draft/2020-12/schema",
  "$id": "https://ai-daily-lab/schema/daily.schema.json",
  "title": "AI Daily Issue",
  "type": "object",
  "additionalProperties": false,
  "required": [
    "schema_version",
    "date",
    "generated_at",
    "editor_note",
    "items",
    "experiments"
  ],
  "properties": {
    "schema_version": {
      "const": 1
    },
    "date": {
      "type": "string",
      "pattern": "^\\d{4}-\\d{2}-\\d{2}$"
    },
    "generated_at": {
      "type": "string",
      "format": "date-time"
    },
    "editor_note": {
      "type": "string",
      "minLength": 20,
      "maxLength": 400,
      "description": "今日导读：2-4 句，概括当天最值得关注的内容"
    },
    "items": {
      "type": "array",
      "minItems": 1,
      "maxItems": 25,
      "items": {
        "$ref": "#/$defs/item"
      }
    },
    "experiments": {
      "type": "array",
      "maxItems": 3,
      "items": {
        "type": "string",
        "pattern": "^\\d{4}-\\d{2}-\\d{2}-[a-z0-9][a-z0-9-]*$"
      }
    },
    "tldr": {
      "type": "array",
      "minItems": 1,
      "maxItems": 3,
      "description": "今日三件事：每句对应一个条目，30 秒看懂今天",
      "items": {
        "type": "object",
        "additionalProperties": false,
        "required": [
          "text",
          "item_id"
        ],
        "properties": {
          "text": {
            "type": "string",
            "minLength": 8,
            "maxLength": 60
          },
          "item_id": {
            "type": "string",
            "pattern": "^\\d{4}-\\d{2}-\\d{2}-[a-z0-9][a-z0-9-]*$"
          }
        }
      }
    }
  },
  "$defs": {
    "item": {
      "type": "object",
      "additionalProperties": false,
      "required": [
        "id",
        "category",
        "title",
        "summary",
        "key_points",
        "why_it_matters",
        "sources",
        "tags",
        "importance"
      ],
      "properties": {
        "id": {
          "type": "string",
          "pattern": "^\\d{4}-\\d{2}-\\d{2}-[a-z0-9][a-z0-9-]*$"
        },
        "category": {
          "enum": [
            "news",
            "opensource",
            "tools",
            "ideas",
            "practices",
            "research",
            "skills"
          ]
        },
        "title": {
          "type": "string",
          "minLength": 4,
          "maxLength": 60
        },
        "summary": {
          "type": "string",
          "minLength": 20,
          "maxLength": 500
        },
        "key_points": {
          "type": "array",
          "minItems": 2,
          "maxItems": 5,
          "items": {
            "type": "string",
            "minLength": 4,
            "maxLength": 160
          }
        },
        "why_it_matters": {
          "type": "string",
          "minLength": 10,
          "maxLength": 300
        },
        "sources": {
          "type": "array",
          "minItems": 1,
          "maxItems": 5,
          "items": {
            "type": "object",
            "additionalProperties": false,
            "required": [
              "title",
              "url",
              "kind"
            ],
            "properties": {
              "title": {
                "type": "string",
                "minLength": 2
              },
              "url": {
                "type": "string",
                "pattern": "^https?://"
              },
              "kind": {
                "enum": [
                  "primary",
                  "secondary",
                  "discussion"
                ]
              },
              "publisher": {
                "type": "string"
              },
              "published_at": {
                "type": "string",
                "pattern": "^\\d{4}-\\d{2}-\\d{2}"
              }
            }
          }
        },
        "tags": {
          "type": "array",
          "minItems": 1,
          "maxItems": 4,
          "items": {
            "type": "string",
            "pattern": "^[a-z0-9][a-z0-9-]*$"
          }
        },
        "importance": {
          "type": "integer",
          "minimum": 1,
          "maximum": 5
        },
        "follow_up_of": {
          "type": "string"
        },
        "experiment_id": {
          "type": "string"
        },
        "repo": {
          "type": "object",
          "additionalProperties": false,
          "description": "opensource 类可选：仓库信息",
          "properties": {
            "url": {
              "type": "string",
              "pattern": "^https://"
            },
            "license": {
              "type": "string"
            },
            "language": {
              "type": "string"
            }
          }
        },
        "actionability": {
          "enum": [
            "try",
            "watch",
            "know"
          ],
          "description": "try=可动手（读者今天就能安装或试用），watch=值得关注，know=了解即可"
        },
        "skill": {
          "type": "object",
          "additionalProperties": false,
          "description": "AI 软技能条目专用：一个场景下「较差 vs 更好」的对比示例",
          "required": [
            "area",
            "scenario",
            "bad",
            "good",
            "why"
          ],
          "properties": {
            "area": {
              "enum": [
                "goal",
                "context",
                "decompose",
                "review",
                "iterate",
                "delegate",
                "judgment"
              ],
              "description": "goal=目标表达 context=上下文供给 decompose=任务拆解 review=审查验证 iterate=反馈迭代 delegate=委派与边界 judgment=判断与取舍"
            },
            "scenario": {
              "type": "string",
              "minLength": 8,
              "maxLength": 120,
              "description": "具体工作场景"
            },
            "bad": {
              "type": "string",
              "minLength": 4,
              "maxLength": 600,
              "description": "较差的做法/描述（示例）"
            },
            "good": {
              "type": "string",
              "minLength": 10,
              "maxLength": 1200,
              "description": "更好的做法/描述（示例）"
            },
            "why": {
              "type": "array",
              "minItems": 2,
              "maxItems": 4,
              "items": {
                "type": "string",
                "minLength": 4,
                "maxLength": 120
              },
              "description": "好在哪里，每条一句"
            },
            "practice": {
              "type": "string",
              "maxLength": 160,
              "description": "可选：一个今天就能做的小练习"
            }
          }
        }
      }
    }
  }
}
