{
  "schema_version": 1,
  "date": "2026-10-20",
  "generated_at": "2026-10-20T06:40:00+08:00",
  "editor_note": "今天的主线是「更快、更便宜、可本地化」：Inception 的扩散模型 Mercury 3 与 MiniMax M3.1 Flash 主打速度和成本，Reflection Beam、NVIDIA Nemotron 3.5 Bolt 等开放权重持续扩容。理念方面，PostgreSQL 19 因 LLM 评审挖出大量问题而撤回功能，引发对 AI 评审节奏的讨论。配套实验用正则复现了「AI 腔」评分。",
  "items": [
    {
      "id": "2026-10-20-inception-mercury-3",
      "category": "news",
      "title": "Inception 发布扩散式大模型 Mercury 3：1M 上下文、千级 token/s",
      "summary": "Inception 于 10 月 19 日发布基于扩散（diffusion）而非自回归生成的 Mercury 3，总参数是 Mercury 1 的 40 倍以上，上下文从 Mercury 2.5 的 260K 扩展到 1M token。官方称其在 NVIDIA GPU 上达到 1,068 tokens/s，并兼容 OpenAI API。",
      "key_points": [
        "官方定价为每百万 token 输入 $0.20、输出 $0.70，发布期五折；缓存输入按输入价格的一折计费",
        "已上线 Inception API 平台、OpenRouter、Baseten 和 Vercel，API 平台提供 1 亿 token 免费额度",
        "官方称多项基准超过 GPT-6 Luna 和 Claude Haiku 5.5，但发布页未给出具体分数表",
        "在 50 个 Mind2Web 浏览器任务中完成 50%（厂商自测）"
      ],
      "why_it_matters": "扩散式语言模型在速度上的优势正在走向长上下文和 Agent 场景，对延迟敏感的应用值得关注；性能数据目前均来自厂商，选型前需自行评测。",
      "sources": [
        {
          "title": "Introducing Mercury 3",
          "url": "https://www.inceptionlabs.ai/blog/introducing-mercury-3",
          "kind": "primary",
          "publisher": "Inception",
          "published_at": "2026-10-19"
        }
      ],
      "tags": [
        "llm",
        "inference"
      ],
      "importance": 4
    },
    {
      "id": "2026-10-20-minimax-m3-1-flash",
      "category": "news",
      "title": "MiniMax 发布 M3.1 Flash：面向 Agent，称使用成本降 70%",
      "summary": "MiniMax 于 10 月 19 日发布 M3.1 Flash，定位为面向 Agent、编程、Computer Use 和网络安全任务的新一代 Flash 模型。官方称在 Agent 任务上整体使用成本比上一代低 70%，在线推理速度接近三倍。权重将在之后发布，发布页未给出具体日期。",
      "key_points": [
        "定价为每百万 token 输入 $0.15、输出 $0.60、缓存输入 $0.015",
        "官方公布 DeepSWE v1.1 为 73.7%、OSWorld V2 为 61.7、Agents' Last Exam 为 29.6",
        "日常输出速度 200+ TPS，P50 中位速度 170+ TPS",
        "可通过 MiniMax API、M Plan 和 MiniMax Code 使用"
      ],
      "why_it_matters": "低价、高速的 Agent 向模型继续压低长链路任务的成本；权重开放后可作为私有化部署的候选，届时需关注许可证。",
      "sources": [
        {
          "title": "MiniMax M3.1 Flash: Redefining Agent Performance and Cost",
          "url": "https://www.minimax.io/blog/minimax-m31f",
          "kind": "primary",
          "publisher": "MiniMax",
          "published_at": "2026-10-19"
        }
      ],
      "tags": [
        "llm",
        "agent",
        "coding"
      ],
      "importance": 3
    },
    {
      "id": "2026-10-20-anthropic-independent-evaluators",
      "category": "news",
      "title": "Anthropic 让 METR 以「类员工」权限独立评估，并公布三级评估框架",
      "summary": "Anthropic 于 10 月 15 日宣布，非营利评估机构 METR 的 6 名员工获得「类员工」访问权限，可使用公司硬件、办公空间和内部工具，并可公开发布对 Anthropic 风险水平和做法的分析，Anthropic 无权否决发布，只能要求删去预先约定类别的信息（如机密知识产权）。",
      "key_points": [
        "提出三级评估者访问框架：Tier 1 范围窄、发布需批准；Tier 2 可不经批准发布；Tier 3 即 METR 这类类员工权限",
        "SecureBio 正在审阅 8 月风险报告中的化学与生物武器章节",
        "与 Accenture 和 Faculty 推进覆盖评测、红队和对齐评估的合作，并与 Hugging Face 等机构初步接洽",
        "Anthropic 将其类比银行监管中派驻检查员的做法，并认为所有前沿 AI 公司都应这样做"
      ],
      "why_it_matters": "第三方评估从「受邀测试」走向「内部驻场 + 独立发布」，可能成为前沿模型治理的新参照，值得关注其他公司是否跟进。",
      "sources": [
        {
          "title": "An update on independent evaluators",
          "url": "https://www.anthropic.com/news/an-update-on-independent-evaluators",
          "kind": "primary",
          "publisher": "Anthropic",
          "published_at": "2026-10-15"
        }
      ],
      "tags": [
        "safety",
        "policy"
      ],
      "importance": 3
    },
    {
      "id": "2026-10-20-cern-mistral-physics-model",
      "category": "news",
      "title": "CERN 与 Mistral 结盟，计划训练对撞机物理基础模型",
      "summary": "CERN 与 Mistral 于 10 月 15 日签署意向声明，建立面向科学发现的基础模型长期合作，首个目标是训练一个统一的预训练「Large Physics Model」，号称首个对撞机物理基础模型。模型将以 LHC 数十亿次模拟质子-质子碰撞为训练数据。",
      "key_points": [
        "目标任务包括碰撞重建、粒子识别、标记异常信号和评估未来探测器设计",
        "希望用一个模型覆盖目前由一连串专用算法完成的整个重建链",
        "CERN 已存储约 1 EB 的 LHC 实验数据，HL-LHC 预计 2030 年前后运行后碰撞数将增加十倍",
        "公告未披露资金、治理安排和时间表"
      ],
      "why_it_matters": "「领域基础模型」正从文本、图像扩展到大科学装置数据，可作为科学计算团队评估 AI 替代专用流水线的参考案例。",
      "sources": [
        {
          "title": "CERN and Mistral join forces to accelerate AI for science",
          "url": "https://home.cern/cern-and-mistral-join-forces-to-accelerate-ai-for-science/",
          "kind": "primary",
          "publisher": "CERN",
          "published_at": "2026-10-15"
        },
        {
          "title": "Hacker News 讨论",
          "url": "https://news.ycombinator.com/item?id=50153630",
          "kind": "discussion",
          "publisher": "Hacker News"
        }
      ],
      "tags": [
        "research",
        "llm"
      ],
      "importance": 2
    },
    {
      "id": "2026-10-20-aws-torchneuron",
      "category": "opensource",
      "title": "AWS 开源 TorchNeuron：Trainium 的原生 PyTorch 后端",
      "summary": "PyTorch 官方博客 10 月 19 日发文介绍 TorchNeuron，这是 AWS Trainium 芯片的原生 PyTorch 后端，通过 PrivateUse1 扩展点和 torch.accelerator API 接入，将于 10 月 20 日在 PyTorch Conference North America 以 Apache 2.0 许可开源并进入公开 Beta，仓库为 aws-neuron/torch-neuronx。",
      "key_points": [
        "模型代码只需 .to('neuron') 即可迁移，支持 eager 模式和 torch.compile（backend=\"neuron\"）",
        "支持 DDP、FSDP2、张量/流水线并行、DTensor 等分布式能力，适用于 Trainium2 和 Trainium3",
        "首个版本暂不支持稀疏张量、NestedTensor、前向模式自动微分和动态形状",
        "AWS 称已对 10 万个 Hugging Face 模型做了盲测运行，vLLM 和 Transformers v5 的集成仍在推进中"
      ],
      "why_it_matters": "非 NVIDIA 加速器在 PyTorch 上的「原生体验」继续改善，降低了在 Trainium 上训练和推理的迁移成本；正式使用前需核对不支持的特性清单。",
      "sources": [
        {
          "title": "Introducing TorchNeuron: Native PyTorch backend for AWS Trainium",
          "url": "https://pytorch.org/blog/introducing-torchneuron-native-pytorch-backend-for-aws-trainium/",
          "kind": "primary",
          "publisher": "PyTorch",
          "published_at": "2026-10-19"
        }
      ],
      "tags": [
        "infra",
        "inference"
      ],
      "importance": 3,
      "repo": {
        "url": "https://github.com/aws-neuron/torch-neuronx",
        "license": "Apache-2.0"
      }
    },
    {
      "id": "2026-10-20-reflection-beam-501b",
      "category": "opensource",
      "title": "Reflection AI 开源 Beam：501B 参数 MoE，Apache 2.0 许可",
      "summary": "Reflection AI 于 10 月 16 日发布开放权重模型 Beam 1.0，为总参数 501B、激活参数 23B 的稀疏 MoE 模型，采用 Apache 2.0 许可，权重提供 BF16、FP8 和 NVFP4 三种精度，并附带一个投机解码草稿模型。模型卡标注上下文长度为 1M token。",
      "key_points": [
        "模型卡列出 SWE-bench Verified 81.6%、Terminal Bench v2.1 80.1%、GPQA Diamond 90.6%",
        "可自托管，也可通过 Reflection 自有 API 及 AWS、Google Cloud、Together AI、Ollama 等众多平台使用",
        "支持 Dell、HPE 的本地和离线部署，同时开源了 Agent 运行框架 Mirror CLI"
      ],
      "why_it_matters": "宽松许可证的大规模开放权重模型又多一个选项，对需要商用私有化部署的团队意义较大；基准分数为厂商自报。",
      "sources": [
        {
          "title": "Beam is now available",
          "url": "https://reflection.ai/blog/beam-is-available",
          "kind": "primary",
          "publisher": "Reflection AI",
          "published_at": "2026-10-16"
        },
        {
          "title": "Beam-1.0-501B-A23B 模型卡",
          "url": "https://huggingface.co/reflection/Beam-1.0-501B-A23B",
          "kind": "primary",
          "publisher": "Hugging Face"
        }
      ],
      "tags": [
        "open-weights",
        "llm",
        "coding"
      ],
      "importance": 4,
      "repo": {
        "url": "https://huggingface.co/reflection/Beam-1.0-501B-A23B",
        "license": "Apache-2.0"
      }
    },
    {
      "id": "2026-10-20-nemotron-3-5-bolt",
      "category": "opensource",
      "title": "NVIDIA 发布 Nemotron 3.5 Bolt：74B MoE 压进 24GB 本地运行",
      "summary": "NVIDIA 在 Hugging Face 发布 Nemotron 3.5 Bolt 74B-A9B 24GB，这是从 Nemotron 3.5 Super VL 120B-A12B 压缩而来的 Mamba-2/Transformer 混合 LatentMoE 多模态模型，总参数 74B、激活 9B，采用 2-bit（IQ2）量化的 24GB 打包检查点，目标是在 24GB 内存内本地运行。",
      "key_points": [
        "上下文最长 256K token，许可证为 OpenMDW-1.1，允许商用",
        "模型卡对比显示 GPQA Diamond 86.43、Terminal-Bench 2.1 50.98、BrowseComp 66.75，多数项高于 Qwen3.6-35B-A3B",
        "也有落后项：PinchBench 略低于 Qwen3.6，AA-Omniscience 准确率低于 Gemma4",
        "模型卡中关于部署硬件的描述前后不完全一致，需以实际测试为准"
      ],
      "why_it_matters": "「架构搜索 + 极低比特量化」让中大型 MoE 能在单卡或高配笔记本上运行，适合关注本地 Agent 的团队评测。",
      "sources": [
        {
          "title": "NVIDIA-Nemotron-3.5-Bolt-74B-A9B-24GB 模型卡",
          "url": "https://huggingface.co/nvidia/NVIDIA-Nemotron-3.5-Bolt-74B-A9B-24GB",
          "kind": "primary",
          "publisher": "NVIDIA",
          "published_at": "2026-10-15"
        }
      ],
      "tags": [
        "open-weights",
        "inference",
        "multimodal"
      ],
      "importance": 3
    },
    {
      "id": "2026-10-20-ibm-granite-switch-4-1",
      "category": "opensource",
      "title": "IBM 发布 Granite Switch 4.1：一个端点同时做对话、判断和语音转写",
      "summary": "IBM 于 10 月 15 日发布 Granite Switch 4.1（8B 和 30B），在 Granite 4.1 基座上组合多个 Activated LoRA（aLoRA）适配器和一个 0.5B 的语音识别模型，使同一个端点可以完成对话、通用/安全判断和英文语音转写。8B 版本采用 Apache 2.0 许可，上下文 128K。",
      "key_points": [
        "aLoRA 可复用基座模型生成时的 KV cache，任务间切换快，整体显存占用与基座模型相当",
        "包含通用 Decision aLoRA 和安全向 Guardian aLoRA",
        "可在 vLLM（需插件）和 llama.cpp 中运行，代码在 GitHub generative-computing/granite-switch"
      ],
      "why_it_matters": "把分类、护栏、转写等「小判断」挂在同一个模型上，是降低 Agent 流水线中多模型部署成本的一种思路。",
      "sources": [
        {
          "title": "Granite Switch 4.1: Chat, Decisions, and Speech from One Endpoint",
          "url": "https://huggingface.co/blog/ibm-granite/granite-switch-4-1",
          "kind": "primary",
          "publisher": "IBM / Hugging Face",
          "published_at": "2026-10-15"
        },
        {
          "title": "granite-switch-4.1-8b 模型卡",
          "url": "https://huggingface.co/ibm-granite/granite-switch-4.1-8b",
          "kind": "primary",
          "publisher": "Hugging Face"
        }
      ],
      "tags": [
        "open-weights",
        "fine-tuning",
        "inference"
      ],
      "importance": 2,
      "repo": {
        "url": "https://github.com/generative-computing/granite-switch"
      }